{
  "$schema": "https://json-schema.org/draft/2020-12/schema",
  "$id": "https://chromalab.local/schemas/benchmark/stage123456-parity-record.schema.json",
  "title": "ChromaLab Stage 1-6 Parity Record",
  "description": "Shadow/parity record for image preparation, graph discovery, plotArea/layout, axis/frame/scale evidence, calibration strategy output, and automatic OCR anchor candidate evidence.",
  "type": "object",
  "required": [
    "schemaVersion",
    "recordId",
    "fixtureId",
    "mode",
    "sourceId",
    "sourceKind",
    "productionImpact",
    "runtimeReadiness",
    "expectedGraphCount",
    "detectedGraphCount",
    "graphCountScore",
    "expectedLayoutClass",
    "predictedLayoutClass",
    "layoutClassScore",
    "imagePreparation",
    "graphDiscovery",
    "plotAreaLayout",
    "axisFrameScale",
    "calibrationStrategy",
    "ocrAnchorCandidate",
    "evidence",
    "promotionDecision",
    "notes"
  ],
  "additionalProperties": false,
  "properties": {
    "schemaVersion": {
      "const": "chromalab.benchmark.stage123456_parity_record.v1"
    },
    "recordId": {
      "type": "string",
      "minLength": 1
    },
    "fixtureId": {
      "type": "string",
      "minLength": 1
    },
    "mode": {
      "enum": [
        "deterministic",
        "model_enabled",
        "pc_prototype",
        "annotation_upper_bound"
      ]
    },
    "sourceId": {
      "type": "string",
      "minLength": 1
    },
    "sourceKind": {
      "enum": [
        "PC_STAGE6_AUTOMATIC_OCR_ANCHOR_CANDIDATE",
        "PC_PROTOTYPE",
        "ANNOTATION_UPPER_BOUND"
      ]
    },
    "productionImpact": {
      "const": "NONE_SHADOW_ONLY"
    },
    "runtimeReadiness": {
      "type": "string",
      "minLength": 1
    },
    "expectedGraphCount": {
      "type": "integer",
      "minimum": 0
    },
    "detectedGraphCount": {
      "type": "integer",
      "minimum": 0
    },
    "graphCountScore": {
      "enum": [
        "PASS",
        "FAIL",
        "MISSING",
        "NOT_SCOREABLE"
      ]
    },
    "expectedLayoutClass": {
      "type": "string",
      "minLength": 1
    },
    "predictedLayoutClass": {
      "type": "string",
      "minLength": 1
    },
    "layoutClassScore": {
      "enum": [
        "PASS",
        "FAIL",
        "MISSING",
        "NOT_SCOREABLE"
      ]
    },
    "imagePreparation": {
      "$ref": "#/$defs/stageEvidence"
    },
    "graphDiscovery": {
      "$ref": "#/$defs/stageEvidence"
    },
    "plotAreaLayout": {
      "$ref": "#/$defs/stageEvidence"
    },
    "axisFrameScale": {
      "$ref": "#/$defs/stageEvidence"
    },
    "calibrationStrategy": {
      "$ref": "#/$defs/stageEvidence"
    },
    "ocrAnchorCandidate": {
      "$ref": "#/$defs/stageEvidence"
    },
    "failureClass": {
      "type": "string"
    },
    "firstFailingStage": {
      "type": "string"
    },
    "evidence": {
      "type": "object",
      "required": [
        "sourceImage",
        "recordSource",
        "artifactPaths"
      ],
      "additionalProperties": false,
      "properties": {
        "sourceImage": {
          "type": "string"
        },
        "recordSource": {
          "type": "string",
          "minLength": 1
        },
        "artifactPaths": {
          "type": "array",
          "items": {
            "type": "string"
          }
        }
      }
    },
    "promotionDecision": {
      "enum": [
        "STAGE6_CANDIDATE_REQUIRES_ANDROID_OCR_ANCHOR_PARITY",
        "PROMOTION_CANDIDATE_REQUIRES_RUST_OR_RUNTIME_PARITY",
        "DO_NOT_PROMOTE_RESEARCH_ONLY"
      ]
    },
    "notes": {
      "type": "array",
      "items": {
        "type": "string"
      }
    }
  },
  "$defs": {
    "stageEvidence": {
      "type": "object",
      "required": [
        "status",
        "available",
        "summary"
      ],
      "additionalProperties": false,
      "properties": {
        "status": {
          "enum": [
            "PASS",
            "REVIEW",
            "FAIL",
            "VALID",
            "INVALID",
            "MISSING",
            "NOT_RECORDED",
            "NOT_SCORED"
          ]
        },
        "available": {
          "type": "boolean"
        },
        "summary": {
          "type": "string"
        },
        "metrics": {
          "type": "object",
          "additionalProperties": {
            "anyOf": [
              {
                "type": "number"
              },
              {
                "type": "integer"
              },
              {
                "type": "boolean"
              },
              {
                "type": "string"
              }
            ]
          }
        }
      }
    }
  }
}
